CAT NUMBER,EVENT NAME,CAT EVENT START,CAT EVENT FINISH,FinYeae,STATE,REGION / TOWN,DESCRIPTION2,Location,Type,YEAR,ORIGINAL LOSS VALUE,NORMALISED LOSS VALUE (2017),TOTAL CLAIMS RECEIVED,Domestic Building Claims,Domestic Content Claims,Domestic Motor Claims,Domestic Other Claims,Commercial Property Claims,Commercial motor,Commercial BI Claims,Commercial Other Claims,Commercial Crop Claims
CAT841,Sydney Floods,8/19/1984,8/19/1984,1984-85,NSW,,"On the 8 November 1984, thunderstorms caused extremely heavy rain over a sizeable area near the centre of Sydney. Observatory Hill recorded 196 mm in three hours. Due to large expanses of urban areas being paved, much of the rainfall became flood run-off, causing damage to homes along the Harbour. Vehicles were swept off roads or buried in mud. Thousands of homes were flooded, and hundreds of people evacuated.",,Flooding,1984,80000000,712680044,,,,,,,,,,
Undeclared,Cyclone DARYL,6/19/1984,3/20/1984,1983-84,WA,,"Indian Ocean event, no Australian landfall",,Cyclone,1984,,,,,,,,,,,,
Undeclared,Cyclone JIM,5/19/1984,10/19/1984,1983-84,NT QLD,,"Cyclone Jim developed from a low just southeast of the mainland on Papua New Guinea on 6 March. The storm slowly deepened while heading generally west-southwestward. Early on 8 March, Jim struck Cape Grenville, Queensland. Jim left minor damage to vegetation and downed some large trees. After crossing the Cape York Peninsula, the system emerged into the Gulf of Carpentaria and later made landfall on 9 March at Port Roper, Northern Territory, which is just south of Numbulwar. Jim dissipated on the following day. A 15 m (49 ft) boat was beach at Alyangula. Inland, wind gusts as high as 100 km/h (62 mph) downed trees in the vicinity of the Roper River.",FNQ,Cyclone,1984,,,,,,,,,,,,
Undeclared,Cyclone HARVEY,3/19/1984,9/19/1984,1983-84,QLD,,A low spawned within the monsoon trough developed into Tropical Cyclone Harvey on 3 February. The system moved generally east-southeastward and entered the South Pacific basin on 7 February.,FNQ,Cyclone,1984,,,,,,,,,,,,
Undeclared,Cyclone EMMA,3/19/1984,12/13/1984,1983-84,WA,,"A Category 3 cyclone, Emma struck Western Australia on December 12, 1984 as a Category 1 cyclone.",,Cyclone,1984,,,,,,,,,,,,
Undeclared,Cyclone ANNETTE,3/19/1984,2/16/1984,1983-84,WA,,"Cyclone Annette developed simultaneously with Cyclone Willy in the Australian basin and Cyclone Haja in the south-west Indian. On February 3, a tropical low formed northeast of the Cocos Islands. Steered by a ridge to the south, it moved generally southwestward and intensified into Tropical Cyclone Annette, named by the Bureau of Meteorology. After executing a loop, Annette crossed 80 E into the south-west Indian Ocean on February 16. Upon crossing into the basin, the storm was renamed Jaminy by the Mauritius Meteorological Service.",,Cyclone,1984,,,,,,,,,,,,
Undeclared,Cyclone KATHY,3/16/1984,3/23/1984,1983-84,NT,,"Severe Tropical Cyclone Kathy was a powerful tropical cyclone that devastated the Sir Edward Pellew Group of Islands in March 1984. Originating from a tropical low off the southern coast of Papua New Guinea. Tracking westward, the system attained gale-force winds by 18 March before striking the Cape York Peninsula. After crossing the area, Kathy entered the Gulf of Carpentaria where environmental conditions favored significant development. On 22 March, the storm attained its peak intensity as a Category 5 severe tropical cyclone (Australian tropical cyclone intensity scale) with ten-minute sustained winds of 205 km/h (125 mph). By this time, the storm had been tracking towards the southwest and struck the Sir Edward Pellew Group of Islands later on 22 March before moving over the Australian mainland as a slightly weaker system. Once over land, Kathy rapidly degraded, losing gale-force winds within 24 hours; the storm dissipated over the Northern Territory on 24 March. One person died and damaged totaled to 12 million",,Cyclone,1984,,58176043,,,,,,,,,,
Undeclared,Cyclone CHLOE,2/25/1984,3/19/1984,1983-84,WA,,"On 29 February 1984 Chloe crossed the coast near Roebourne, Western Australia where three houses were destroyed and twelve others unroofed. Fifty people required evacuation as floodwaters from the Harding River rose to the lower steps of the Police Station. Parts of the Wickham High Schools were severely damaged and two buildings and a boat were destroyed in the Cossack/Point Samson area. The Dampier Yacht Club was unroofed.",,Cyclone,1984,,,,,,,,,,,,
Undeclared,Cyclone INGRID,2/20/1984,2/25/1984,1983-84,QLD,,"A tropical low developed into Cyclone Ingrid to the east of Innisfail, Queensland, on 20 February. Ingrid moved eastward and then east-southeastward by 23 February. The storm then curved southwestward and dissipated on 25 February. Ingrid brought strong winds and caused minor flooding in Cairns and Mackay.",FNQ,Cyclone,1984,,,,,,,,,,,,
Undeclared,Cyclone WILLY,2/19/1984,11/19/1984,1983-84,WA,,A weak low developed into Tropical Cyclone Willy on 2 February. The system headed southwestward and dissipated on 11 February.,,Cyclone,1984,,,,,,,,,,,,
Undeclared,Cyclone FERDINAND,2/19/1984,4/19/1984,1983-84,NT,,"A weak tropical low intensified into Tropical Cyclone Ferdinand on 2 March. The cyclone moved eastward to east-southward and paralleled the northern coast of Northern Territory, until making landfall near Maningrida on 4 March. Ingrid dissipated on the following day. Goulburn Island and the Miningrida area experienced minor damage",,Cyclone,1984,,,,,,,,,,,,
Undeclared,Cyclone TIM,2/19/1984,10/19/1984,1983-84,WA,,"Tim formed from a low pressure area to the southeast of Christmas Island on 2 January 1984. After moving northwest, Tim turned southward on 6 January. The cyclone decayed to a tropical low by 10 January.",,Cyclone,1984,,,,,,,,,,,,
Undeclared,Cyclone BOBBY,2/17/1984,2/23/1984,1983-84,WA,,"Bobby formed within the monsoon trough to the northwest of Broome, Western Australia, on 17 February. Bobby moved southwestward for much of its duration and dissipated by 23 February.",,Cyclone,1984,,,,,,,,,,,,
Undeclared,Cyclone VIVIENNE,1/23/1984,1/27/1984,1983-84,WA,,"The origins of Vivienne-Fanja are unclear as a result of sparseness of data, due to a disruption in satellite imagery coverage. It is estimated that a tropical low formed on January 23 west of Christmas Island in the Australian basin. The Bureau of Meteorology named the storm Vivienne, which gradually intensified while moving to the west. On January 27, the cyclone crossed 80? E into the southwest Indian Ocean, at which time it was renamed Fanja.",,Cyclone,1984,,,,,,,,,,,,
Undeclared,Cyclone 198384_06,12/21/1983,12/24/1983,1983-84,WA,,"Operationally, this cyclone was considered to have been the redeveloped remnants of Esther. The storm developed from a cloud cluster near the southern tip of Timor on 21 December. The system moved west-northward and dissipated on 24 December.[6]",,Cyclone,1983,,,,,,,,,,,,
Undeclared,Cyclone ESTHER,12/18/1983,12/20/1983,1983-84,WA,,"Indian ocean,no Australian landfall.",,Cyclone,1983,,,,,,,,,,,,
Undeclared,Cyclone QUENTON,11/26/1983,11/30/1983,1983-84,WA,,"Quenton developed on 26 November from a low pressure situated south of Java. Making landfall in Western Australia on 29 November, Quenton was the first tropical cyclone to strike Australia in the month of November since Ines in 1973. The cyclone dissipated on the following day.[3]",,Cyclone,1983,,,,,,,,,,,,
Undeclared,Cyclone PEARL,11/19/1983,11/14/1983,1983-84,QLD,,"Indian ocean, no Australian landfall.",FNQ,Cyclone,1983,,,,,,,,,,,,
Undeclared,Cyclone OSCAR,10/22/1983,1/19/1983,1983-84,WA,,"Indian ocean, no Australian landfall",,Cyclone,1983,,,,,,,,,,,,
Undeclared,Cyclone ELINOR,10/19/1983,3/19/1983,1983-84,QLD,,"In March 1983, Cyclone Elinor made landfall in Queensland, wrecking two yachts.[2]",FNQ,Cyclone,1983,,,,,,,,,,,,
Undeclared,Cyclone FRITZ,9/19/1983,12/13/1983,1983-84,QLD,,"Pacific ocean, no Australian landfall. ",FNQ,Cyclone,1983,,,,,,,,,,,,
Undeclared,Cyclone MONTY,4/22/1983,4/29/1983,1982-83,WA,,Monty was a small but intense cyclone that developed off the Pilbra coast before making landfall near Mardie Station. It then moved off the coast becoming a CAT 4 and making landfall againnear Onlslow.  Heavy rain caused flooding in the area.,,Cyclone,1983,,,,,,,,,,,,
Undeclared,Cyclone NAOMI,4/21/1983,2/19/1983,1982-83,WA,,"A tropical low developed near the western edge of the Australia region basin on 21 April. After strengthening into Cyclone Naomi, the system headed southeastward for much of its duration. By 30 April, Naomi doubled-back and moved northwestward, but dissipated on 2 May.",,Cyclone,1983,,,,,,,,,,,,
Undeclared,Cyclone KEN,2/28/1983,6/19/1983,1982-83,QLD,,"Pacific ocean, no Australian landfall. ",FNQ,Cyclone,1983,,,,,,,,,,,,
Undeclared,Cyclone LENA,2/19/1983,9/19/1983,1982-83,WA,,"<br />Lena formed off the coast of Indonesia on April 3, 1983. The storm reached Category 2 status before making landfall at Port Hedland, Australia. The storm dissipated on April 9.",,Cyclone,1983,,,,,,,,,,,,
Undeclared,Cyclone JANE,2/19/1983,10/19/1983,1982-83,WA,,"CAT 4 cyclone hit landfall east of Port Headland, not causing any real damage.",,Cyclone,1983,,,,,,,,,,,,
CAT832,Ash Wednesday Bushfire,2/16/1983,2/16/1983,1982-83,VIC,,"The Victorian and South Australian bushfire season started in November 1982 with 854 bushfires affecting Ballan, Mount Macedon (on 1 February), Cann River and Mount Donna Buang. On early Ash Wednesday morning there were 104 fires already burning in Victoria. Most were controlled or contained, but after 2pm the situation exploded. The fires formed several complexes.<br /><br />1. Western district near Warrnambool. In total nine people died, 50,000 hectares were burnt, 157 houses destroyed and 19,300 head of  livestock were lost. <br /><br />2. East Trentham? Macedon fire complex. Seven people died, 20,000 hectares were burnt, 200 homes destroyed in Macedon, 150 on Mount Macedon, 50 in Bullengarook and 20 in Woodend.<br /><br />3. Otways complex.  Three people were killed and 578 houses and other buildings were lost.<br /><br />4. Upper Beaconsfield ? Cockatoo complex.  In total, 27 people died, 100 were injured and 535 houses and buildings were destroyed.<br /><br />5. Warburton complex. Thirty houses were destroyed.<br /><br />6. South Australia - In total 28 people died, including three CFS volunteer fire fighters. More than 1500 people were injured, 383 homes and 200 other buildings destroyed and 160,000 hectares were burnt.",,Bushfire,1983,176000000,1761595800,,,,,,,,,,
CAT831,Bushfire Ash Wednesday,1/19/1983,1/19/1983,1982-83,NSW,,"In January 1983 a number of fires caused significant damage to areas in and around the Sydney region.<br /> Approximately 60,000 ha of land including a pine forest was lost",,Bushfire,1983,12000000,117230194,,,,,,,,,,
Undeclared,Cyclone DES,1/14/1983,1/23/1983,1982-83,QLD,,"A tropical depression developed within a monsoon trough east-northeast of Cairns, Queensland, on 14 January. Des moved east-southeastward and strengthened gradually. Later, the storm tracked generally northward, until curving eastward and dissipating on 23 January.",FNQ,Cyclone,1983,,,,,,,,,,,,
,Ash Wednesday Bushfire,,,1982-83,SA,,,,Bushfire,1983,,582725520,,,,,,,,,,
Undeclared,Cyclone HARRIET,12/19/1982,2/21/1982,1982-83,WA,,"Indian ocean, no Australian landfall.",,Cyclone,1982,,,,,,,,,,,,
Undeclared,Cyclone ERROL,11/19/1982,1/18/1982,1982-83,WA,,"Indian ocean, no Australian landfall.",,Cyclone,1982,,,,,,,,,,,,
Undeclared,Melbourne Gusts,11/15/1982,,1982-83,VIC,,Sgtrong wind damage across metro Victoria,,,1982,10000000,121638807,,,,,,,,,,
Undeclared,Cyclone DAPHNE-FIFI,10/19/1982,1/21/1982,1982-83,WA,,"CAT 1 Cyclone hit landfall between Port hedland and Broom, casuing very little damage.",,Cyclone,1982,,,,,,,,,,,,
Undeclared,Cyclone BRUNO,10/19/1982,1/21/1982,1982-83,NT,,CAT 1 cyclone hit landfall north of Darwin and travelled overland an left disipated just north of Broome.  Very little damage.,,Cyclone,1982,,,,,,,,,,,,
Undeclared,Cyclone CLAUDIA,5/14/1982,5/17/1982,1981-82,QLD,,"Pacific Ocean, no Australian Landfall.",FNQ,Cyclone,1982,,,,,,,,,,,,
Undeclared,Cyclone DOMINIC,4/19/1982,4/14/1982,1981-82,QLD,,"CAT 1 Cyclone hit landfall near Weipa and crossed the land mass and left on the east coast and returned near Cooktown, causing very little damage.",FNQ,Cyclone,1982,,,,,,,,,,,,
Undeclared,Cyclone CORAL,4/19/1982,6/19/1982,1981-82,NT,,CAT 1 cyclone reached landfall on the east coast of NT causing very little damage.,,Cyclone,1982,,,,,,,,,,,,
Undeclared,Cyclone IAN,2/23/1982,7/19/1982,1981-82,WA,,CAT 3 Cyclone crossed near Weipa and lost intensity as it crossed the land mass anfter leaving the east coast and then returned near Cooktown.,,Cyclone,1982,,,,,,,,,,,,
Undeclared,Cyclone GRAHAM,1/27/1982,2/19/1982,1981-82,WA,,"Reached landfall north of Broome and then travelled inland and left the coast just south of Broom, then returned close to port headland.  Minimal damage.",,Cyclone,1982,,,,,,,,,,,,
Undeclared,Cyclone ABIGAIL,1/22/1982,5/19/1982,1981-82,QLD,,"Pacific Ocean, no Australian Landfall.",FNQ,Cyclone,1982,,,,,,,,,,,,
Undeclared,Cyclone BERNIE,1/19/1982,7/19/1982,1981-82,QLD,,"Pacific Ocean, no Australian Landfall.",FNQ,Cyclone,1982,,,,,,,,,,,,
Undeclared,Cyclone MABEL,12/19/1981,1/21/1981,1981-82,WA,,"Indian Ocean, no Australian landfall.",,Cyclone,1981,,,,,,,,,,,,
Undeclared,Unnamed Cyclone,12/19/1981,12/22/1981,1981-82,NT,,A unnamed CAT 3 Cyclone hit the eastern coast of NT and travelled overland then left land on the western coast into the Indian Ocean.,,Cyclone,1981,,,,,,,,,,,,
Undeclared,Cyclone AMELIA,11/30/1981,6/19/1981,1981-82,NT,,On 1 December a TL hit lanfall Southern part of the Gulf of Capentaria.  It then moved along the fringe of the N T coast.  It caised very little damage.  ,,Cyclone,1981,,,,,,,,,,,,
Undeclared,Cyclone MAX,9/19/1981,3/19/1981,1981-82,NT,,A low formed near the top end and formed into a TC and passed close to Darwin.  Little damage. ,,Cyclone,1981,,,,,,,,,,,,
CAT811,Cyclone CLIFF,9/19/1981,2/15/1981,1981-82,QLD,,See CAT 811 below.,FNQ,Cyclone,1981,,,,,,,,,,,,
Undeclared,Cyclone EDDIE,8/19/1981,2/13/1981,1981-82,QLD,,A serverve storm which made lanfall in FNQ then tracked over NT then onto WA. It caused flooding but little structual damage.,FNQ,Cyclone,1981,,,,,,,,,,,,
Undeclared,Cyclone OLGA,5/19/1981,4/15/1981,1980-81,WA,,"Indian Ocean, no Australian landfall.",,Cyclone,1981,,,,,,,,,,,,
Undeclared,Cyclone PADDY,3/24/1981,5/30/1981,1980-81,WA,,"Indian Ocean, no Australian landfall.",,Cyclone,1981,,,,,,,,,,,,
Undeclared,Cyclone FREDA,2/24/1981,,1980-81,QLD,,"Begane as a persistent low which crossed landfall west coast of Capre York Peninsular.  Heavy rain and flooding, but little damage.",FNQ,Cyclone,1981,,,,,,,,,,,,
Undeclared,Cyclone NEIL,2/24/1981,7/19/1981,1980-81,WA,,"Indian Ocean, no Australian landfall.",,Cyclone,1981,,,,,,,,,,,,
Undeclared,Cyclone FELIX,12/22/1980,12/31/1980,1980-81,WA,,"Indian ocean, no Australian landfall",,Cyclone,1980,,,,,,,,,,,,
Undeclared,Cyclone EDNA,12/20/1980,12/27/1980,1980-81,WA,,"Indian ocean, no Australian landfall",,Cyclone,1980,,,,,,,,,,,,
CAT804,Brisbane Storm,12/19/1980,12/19/1980,1980-81,QLD,,"Severe storms in Brisbane, resulting in widespread strom related damage to residential property.",SEQ,Storm,1980,7500000,124006401,,,,,,,,,,
Undeclared,Cyclone ENID,12/19/1980,2/18/1980,1980-81,WA,,"Category 5 cyclone event that impacted the Pilbara region of WA, with limited damage reported.",,Cyclone,1980,,,,,,,,,,,,
CAT805,Brisbane Hail,12/16/1980,12/16/1980,1980-81,QLD,,"A severe storm caused hail damage in northern Brisbane, Bracken Ridge, and extensive damage to 5000 homes in Brighton.",SEQ,Storm,1980,15000000,248012801,,,,,,,,,,
Undeclared,Cyclone DAN,12/14/1980,12/18/1980,1980-81,WA,,"Indian ocean, no Australian landfall",,Cyclone,1980,,,,,,,,,,,,
Undeclared,Cyclone RUTH,11/19/1980,2/18/1980,1980-81,QLD,,"Coral Sea event, no Australian landfall.",FNQ,Cyclone,1980,,,,,,,,,,,,
CAT801,Cyclone AMY,4/19/1980,12/19/1980,1979-80,WA,,Category 5 cyclone event impacting Port Headland,,Cyclone,1980,2700000,42482339,,,,,,,,,,
Undeclared,Cyclone ALICE,3/19/1980,10/19/1980,1979-80,WA,,"Indian ocean, no Australian landfall",,Cyclone,1980,,,,,,,,,,,,
Undeclared,Cyclone SIMON,2/21/1980,2/28/1980,1979-80,QLD,,"Coral Sea Category 4 storm that impacted parts of Far North Queensland, causing riverine flooding",FNQ,Cyclone,1980,,,,,,,,,,,,
CAT803,Adelaide Bushfire,2/19/1980,3/8/1980,1979-80,SA,"Lofty Ranges, Longwood","On 20 February 1980, in the Mount Lofty Ranges, east of Adelaide there was a fire described as an early Ash Wednesday. This fire began two weeks prior in a rubbish dump south-south-east of Adelaide. It smouldered until 20 February when hot winds fanned the fire which burnt 8000 ha in one day. The fire destroyed 51 homes, damaged a further 29 buildings, the Anglican church at Longwood and 75 farms along with orchards and market gardens. 40 people were injured and an estimated 150 individuals were reportedly left homeless. Court cases were held to ascertain who was responsible for this fire and they continued for more than 10 years. The fire caused an estimated $34,000,000 damage. In 1983, after the Ash Wednesday fires in February that year, the 1980 fire became known in South Australia as the ""first"" Ash Wednesday, or Ash Wednesday 1",,Bushfire,1980,13000000,175627673,,80,,,,,,,,
Undeclared,Cyclone PAUL,2/19/1980,8/19/1980,1979-80,QLD,,"As a result of the moisture, very heavy rain caused one of the highest floods of the 20th Century down the Don River through Bowen.[4] In its lower reaches the river changed its course and washed away two homes and caused several million Australian dollars worth of damage to the market garden industry.",FNQ,Cyclone,1980,,,,,,,,,,,,
CAT802,Cyclone DEAN,1/27/1980,4/19/1980,1979-80,WA,,Pilbara region Category 5 cyclone event.,,Cyclone,1980,2500000,35912056,,,,,,,,,,
Undeclared,Cyclone CLARA,1/21/1980,1/29/1980,1979-80,WA,,"Indian ocean, no Australian landfall",,Cyclone,1980,,,,,,,,,,,,
Undeclared,Cyclone BRIAN,1/18/1980,1/27/1980,1979-80,WA,,"Indian ocean, no Australian landfall",,Cyclone,1980,,,,,,,,,,,,
Undeclared,Cyclone WILF,12/23/1979,1/19/1980,1979-80,WA,,"Indian Ocean event, no significant Australian landfall.",,Cyclone,1979,,,,,,,,,,,,
Undeclared,Cyclone KERRY,12/19/1979,4/19/1979,1979-80,QLD,,"Kerry was a remarkable tropical cyclone having a long life-span and erratic track. It is also notorious for being only one of two cyclones in the Australian region to have an airplane (a US NOAA research aircraft) fly into the cyclone (the other being TC Rosa ). Indeed a wind speed of 252 km/h measured by this aircraft at an altitude of 540 m was at that time one of the strongest low-level winds measured in a cyclone in the Australian area. Kerry 's origin is linked to a low that became evident near 5?S, 170?E on 7 February 1979. By 10 February 1979 some cyclonic curvature could be detected in the surrounding convective cloud field. Three days later the system was displaying consistent organisation. The subsequent erratic track is shown below. Kerry intensified steadily while moving west-southwest at 15 to 35 km/h and by 15 February 1979 was classified as a severe tropical cyclone. As Kerry crossed the Solomon Islands maximum observed winds were 72 km/h at about 70 km south of the cyclone, however widespread destruction and loss of life were experienced near the centre, indicating the existence of much stronger winds.. Estimated winds from satellite data were 125 to 145 km/h. After moving away from the Solomon Islands on a southwesterly track, Kerry again intensified steadily. Maximum intensity was attained on 19 February 1979 and Kerry then slowly weakened while moving towards landfall on 1 March 1979. Kerry moved erratically around a large loop from 19 to 26 February 1979 crossing its own track at least three times. A factor in the decay after 19 February was the intrusion of dry sub-tropical air that moved around the west and northwest of the cyclone. This is a common feature of decaying cyclones in the Australian region. Aircraft reconnaissance flights on 21 and 22 February 1979 and satellite imagery together show evidence of this dry air and suppressed convection in these quadrants. As Kerry approached the coast across the Whitsunday Islands radar surveillance showed a weak vortex with a ragged and poorly defined eye, but winds of over 108 km/h were observed. Kerry moved west-northwest over land for just over a day then moved northward back over the Coral Sea. The cyclone began to re-intensify east of Townsville late on 2 March 1979. This re-intensification continued while the cyclone moved northward to be east of Cairns on 3 March. Later that day Kerry came under the influence of strong northwesterly winds ahead of an appraoching large amplitude upper-level trough and accelerated to the southeast, weakened and decayed over the ocean on 6 March 1979. Although Kerry was a severe cyclone while well offshore, it had weakened considerably by the time it made landfall and only minor wind damage occurred in some coastal centres and offshore resorts.Nevertheless, boats collectively worth hundreds of thousands of dollars were damaged or destroyed in Mackay harbour on 1 March 1979. Twenty-four hour rainfall totals of up to 250 mm were reported from mainland centres with an isolated fall of 402 mm from Hayman Island in the Whitsunday Group . Little flood damage resulted however.",FNQ,Cyclone,1979,,,,,,,,,,,,
Undeclared,Cyclone ROSA,11/19/1979,3/19/1979,1979-80,QLD NT WA,,"A persisting cloud cluster was initially detected on satellite photographs near the Solomon Islands on 12 February 1979. The system moved westward and became a tropical depression near Samarai on 14 February 1979. The low moved to the Gulf of Carpentaria where the track became very erratic. The system intensified over the Gulf and attained cyclone strength by 0000 UTC 25 February 1979. The track of the system after 0000 UTC 25 February 1979 is depicted below. The cyclone crossed the coast 30 km north-northwest of Bing Bong homestead at 0400 UTC 26 February 1979 with an estimated central pressure of 955 hPa, the lowest pressure during its life cycle. The lowest recorded pressure was 993.3 hPa at Centre Island (in the Sir Edward Pellew Group ) at 0000 UTC 26 February 1979. The NOAA research aircraft investigated the cyclone on a single mission as the cyclone was making landfall. At the point of closest approach at 0440 UTC 26 February 1979 the maximum wind encountered was 169 km/h at an altitude of 540 m, 37 km northeast of the centre of the eye. The eye diameter was 37 km. The highest 24-hour rainfall totals were 79 mm at McArthur River on 27 February and 74.2 mm at Centre Island on 26 February. An unofficial report from Nathan River estimated 250 mm on 26 February. The highest cumulative total for the period 20 to 28 February 1979 was 197.8 mm at Centre Island. Coastal and riverside stations in the southwest Gulf of Carpentaria reported unusually high tides. Seas were very rough at Bing Bong where the water level was estimated to have risen two metres above the spring high tide mark. A tide gauge on Groote Eylandt was washed away. Thousands of dollars worth of structural damage to station properties, together with the felling of extensive tracts of forest, were reported in the southwest Gulf of Carpentaria and Roper-McArthur district. A light aircraft stranded on North Island, Sir Edward Pellew Group , was destroyed.",FNQ,Cyclone,1979,,,,,,,,,,,,
CAT793,Port Broughton Hailstorm,11/14/1979,11/14/1979,1979-80,SA,,"On 14 November 1979 Port Broughton sustained damage from a line of ferocious storms that hit south-eastern South Australia. Very strong winds and hail ruined solid brick houses, holiday shacks and caravans. Cars were pushed sideways along the road and pine trees up to 30 m tall were uprooted. There was no loss of life during the event which was considered amazing. Eleven people were injured requiring hospital admission and 60 others required hospital treatment. While Port Broughton incurred the most damage, other areas were also affected. Destruction was felt from the mid north to northern Adelaide Plains. Clare experienced severe damage. Houses lost their roofs and sheds were demolished in the high winds. Likewise the northern suburbs of Adelaide saw houses unroofed and trees blown over in areas such Salisbury North, Parafield Gardens, and Munno Para. Agriculture was severely impacted with crops damaged, glass houses broken, grape vines stripped, storage tanks squashed, orchards destroyed and many farmers' livelihoods, built up over many years, were lost within ten minutes. According to the Bureau of Meteorology Regional Forecasting Centre, the thunderstorm triggered by the trough line that extended across Yorke Peninsula moved over Port Broughton and produced destructive winds. The winds at all levels through the atmosphere were very strong. A thunderstorm is classified as severe if it produces wind gusts of 90 km per hour of more. On this day gusts were much higher with reports of 135 km per hour to 160 km per hour. Isolated large hail coming from very cold air high above the earth's surface was rapidly transported to the surface by downdrafts and accompanied the thunderstorms associated with the trough immediately to the east causing damage to some of Adelaide?s northern suburbs.",,Hailstorm,1979,10000000,112700125,,,,,,,,,,
Undeclared,Cyclone VIOLA,9/19/1979,12/19/1979,1979-80,WA,,"Indian Ocean event, no significant Australian landfall.",,Cyclone,1979,,,,,,,,,,,,
