CAT NUMBER,EVENT NAME,CAT EVENT START,CAT EVENT FINISH,FinYeae,STATE,REGION / TOWN,DESCRIPTION2,Location,Type,YEAR,ORIGINAL LOSS VALUE,NORMALISED LOSS VALUE (2017),TOTAL CLAIMS RECEIVED,Domestic Building Claims,Domestic Content Claims,Domestic Motor Claims,Domestic Other Claims,Commercial Property Claims,Commercial motor,Commercial BI Claims,Commercial Other Claims,Commercial Crop Claims
CAT034,Melbourne Severe Storms,1/20/2003,6/20/2003,2002-03,VIC,,"The 2003 Melbourne thunderstorm was a severe weather event that occurred over the city of Melbourne, Australia, and surrounding areas of Victoria, from 1 to 6 December 2003. The Australian Bureau of Meteorology called the storm a ""once in 100-year event"".<br /> According to the Bureau of Meteorology, the storm formed at around midnight on the night of 2 December over Craigieburn, then grew in size as it moved in a south-easterly direction (the Bureau issued a severe thunderstorm warning based on their observations at 11.38 pm). The two hours from midnight to 2 am saw extremely heavy rainfall, with some areas recording more than 100 mm of rain in that time. The rapid rainfall caused flash flooding, which resulted in extensive damage to property.",,Storm,2003,100000000,234582930,,,,,,,,,,
Undeclared,Cyclone ERICA,1/20/2003,12/20/2003,2002-03,QLD,,Coral Sea category 3 cyclone. No Australian landfall.,FNQ,Cyclone,2003,,,,,,,,,,,,
Undeclared,Cyclone HARRIET,1/20/2003,11/20/2003,2002-03,WA,,"A category 1 cyclone developed southwest of Christmas Island, but did not make Australian landfall. Strong winds from cyclone Harriet contributed to a large bushfire near Walpole in Western Australia.  ",,Cyclone,2003,,,,,,,,,,,,
CAT032,Canberra Bushfire,1/18/2003,1/18/2003,2002-03,ACT,,"On 18 January, two fire fronts combined to create a 25 km fire front and wind gusts of up to 65 km per hour propelled the fire towards Canberra. The Chief Minister declared a state of emergency at 2.45 pm and the firestorm hit the outer streets of Duffy at approximately 3 pm, and soon reached the suburbs of Rivett, Chapman, Kambah, Higgins, Hawker and Cook.<br /> Four people were killed by the fires, more than 435 people were injured and there were 5000 evacuations. Approximately 160,000 hectares were burnt which equated to almost 70 per cent of the ACT's pasture, forests and nature parks including Namadgi National Park, Tidbinbilla Nature Reserve and all government pine forest west of the Murrumbidgee River Stromlo pine plantation. There were approximately 488 houses destroyed and many more were damaged.<br /> The Chief Minister and Cabinet Inquiry into the Operational Response to the January 2003 bushfires made 61 recommendations.",,Bushfire,2003,350000000,839446512,,,,,,,,,,
Undeclared,Cyclone Claudia,10/20/2002,12/20/2002,2002-03,QLD,,Coral Sea Category 3 Cyclone. No Australian Landfall,FNQ,Cyclone,2002,,,,,,,,,,,,
CAT023,Southern Sydney Bushfire,9/20/2002,9/20/2002,2002-03,NSW,,"High temperatures combined with severe wind helped a fire get out of control at Engadine on 9 October 2002. The day was labelled a total fire ban day, however fire broke out and quickly spread causing significant damage to homes in Engadine. Other areas affected by fires included Llandilo, Richmond and Windsor-Castlereagh, Bilpin and Narrabri.",,Bushfire,2002,25000000,54957304,,,,,,,,,,
Undeclared,Cyclone Errol,8/20/2002,5/14/2002,2002-03,WA,,Indian Ocean Category 1 Cyclone. No Australian Landfall,,Cyclone,2002,,,,,,,,,,,,
Undeclared,Cyclone Bonnie,7/20/2002,4/15/2002,2002-03,"NT, WA",,Arafura and Timor Sea Category 2 Cyclone. No Australian Landfall,,Cyclone,2002,,,,,,,,,,,,
Undeclared,Cyclone Dianne,6/20/2002,11/20/2002,2001-02,WA,,Indian Ocean Category 4 Cyclone. No Australian Landfall,,Cyclone,2002,,,,,,,,,,,,
Undeclared,Cyclone Upia,5/25/2002,5/29/2002,2001-02,QLD,,Solomon Sea Category 1 Cyclone. No Australian Landfall,FNQ,Cyclone,2002,,,,,,,,,,,,
Undeclared,Cyclone Des,3/20/2002,5/20/2002,2001-02,QLD,,Coral Sea Category 2 Cyclone. No Australian Landfall,FNQ,Cyclone,2002,,,,,,,,,,,,
Undeclared,Cyclone Chris,2/20/2002,7/20/2002,2001-02,WA,,"Cyclone Chris made landfall in WA as a Category 5 severe tropical cyclone, to the west of Pardoo in the states North.  The cyclone caused large losses of cattle. One farmer reported that roughly 20% of the 6,000 cattle he owned died during the storm. In aboriginal communities along the coast, emergency assessment teams discovered that a 500,000 acre cattle farm was completely wiped out. At the town of Bonney Downs, along the Nullagine River, 309 mm of rain produced by the storm caused the river to burst its banks, inundating parts of Nullagine, Western Australia. Significant structural damage was reported in Pardoo where the town's makeshift shelter lost its roof and some of its walls; a shed was destroyed and several homes were damaged. Several buildings in the town were destroyed by the floods, including a preschool. Power lines throughout the area were downed. At the height of the storm, communications were lost with Marble Bar. Throughout the town, only one home sustained roof damage and several fences were knocked over.",,Cyclone,2002,2500000,6360356,,,,,,,,,,
CAT022,Sydney Region Severe Storm,2/16/2002,2/16/2002,2001-02,NSW,,A severe storm crossed the western suburbs of Sydney late in the afternoon of 16 February 2002 causing considerable damage. It moved in a north north-easterly direction at a speed of about 30 km per hour with very heavy rain and strong wind gusts. The strongest wind gust reported was 96 km per hour at Bankstown Airport. The SES received approximately 8000 requests for assistance.,,Storm,2002,18600000,45008993,,,,,,,,,,
CAT021,Northern Rivers Severe Storm,1/16/2002,1/16/2002,2001-02,NSW,,"A severe thunderstorm developed south of Grafton and intensified as it moved north-east toward the coast. Hail and heavy rain were reported at Grafton while at Lismore damaging winds, flash flooding and hail the size of golf balls were reported. The storm was at its highest intensity as it crossed the coast at Kingscliff. Flash flooding, 7 cm hail and a tornado occurred.<br /> Damage was reported at Kingscliff and neighbouring Banora Point. <br /> The New South Wales State Emergency Service deployed approximately 300 volunteers to assist 1000 homes across the state.",,Storm,2002,12500000,34288222,,,,,,,,,,
CAT018,Bushfire,12/24/2001,7/20/2002,2001-02,NSW,,"The Black Christmas bushfires were bushfires that burnt for almost three weeks from 24 December 2001 to 7 January 2002 across New South Wales, Australia. It was the longest continuous bushfire emergency in NSW history.<br /> Low rainfall across winter & spring 2001 combined with a hot, dry December created ideal conditions for bushfires. On the day of Christmas Eve, firefighters from the Grose Vale Rural Fire Service (RFS) brigade attended a blaze in rugged terrain at the end of Cabbage Tree Rd, Grose Vale, believed to have been caused by a poorly extinguished campfire in the Grose Valley.<br /> On Christmas Day, strong westerly winds fuelled more than 100 bushfires across the state, creating a plume of smoke that extended across Sydney. This plume of smoke would not clear for some days as the bushfires continued to burn, creating some of the worst pollution that Sydney has ever experienced, with a regional pollution index reading of: 200 in North-West Sydney; 120 in Central-East and South-West Sydney. The fires mainly burnt in Lane Cove National Park, the Royal National Park & Blue Mountains National Park. Overall approximately 3,000 square kilometres (740,000 acres) were burnt. 121 homes were destroyed across the state and 36 damaged, mostly in the lower Blue Mountains and west of the Royal National Park around Helensburgh. Arsonists were believed to be responsible for starting many of the fires, leading to harsher penalties for those who start bushfires.",,Bushfire,2001,69000000,166968846,,,,,,,,,,
CAT017,Storm,11/18/2001,11/18/2001,2001-02,NSW,,"On 18 November 2001, severe thunderstorms affected many parts of eastern New South Wales. Most of the impact was felt at Nelson Bay, where thunderstorms and tornadoes occurred with winds reaching up to 150 km per hour.  It was reported more than 100 buildings were damaged and several boats destroyed. Significant wind speeds were reported, including 135km/h at Mudgee, 148km/h at Nelson Bay and 150km/h at Narrabri.<br /> Significant damage also occurred in the Lower Hunter Valley and the Sydney metropolitan regions of Penrith, Richmond and Horsley Park from strong wind gusts. Approximately 2000 homes and 200 cars were damaged and three people were killed.<br /> Wisemans Ferry reported hail 3 cm in size. More hail similar in size occurred at Bundarra, Ben Lomond (Northern Tablelands), and in Canberra small hail fell in the northern suburbs on the afternoon on 18 November.",,Storm,2001,30000000,72534998,,,,,,,,,,
CAT016,"Storm, Tornado",11/18/2001,11/18/2001,2001-02,NSW,,Severe weather including reports of a tornado cluster struck Port Stephens causing signifciant damage to property.,,Tornado,2001,30000000,72246158,,,,,,,,,,
Undeclared,Swan Hill 4.8 Earthquake,10/27/2001,10/27/2001,2001-02,VIC,,"Felt in Swan Hill near VIC?NSW border, Minor damage including fallen chimneys and fallen shelves and items. Power disruptions.",,Earthquake,2001,2500000,6067689,,,,,,,,,,
CAT015,"Flood, Storm",9/20/2001,9/20/2001,2001-02,QLD,,"During the period 9 - 11 March 2001, thunderstorm activity brought intense rainfall to the Queensland south-east Coast district.<br /> Subsequent heavy rain affected the Gold Coast and Logan City, with heavy rain falling over Brisbane City, producing areas of flash flooding, particularly across southern suburbs but also in the east and north. Intense rainfall was observed across the district for duration of approximately 6 hours.<br /> Gold Coast and Logan City: A person drowned during the early morning hours of 11 March, when the vehicle in which they were passenger was swept off a road near Logan. Many homes and businesses were damaged by flash flooding. Flooding at Beenleigh also led to four houses being inundated with sewage.<br /> Brisbane City: A person was confirmed drowned, after being swept away by flood waters on the evening of 9 March, when vehicle in which they were passenger was washed off a road at Lawnton (in Brisbane's north). The damage inventory included hundreds of cars, many shops and offices, and up to 600 homes.<br /> Stones Corner, a suburb in inner-eastern Brisbane, was one of the worst hit areas. Metre-deep flooding entered East's League's Club, forcing 50 patrons to be evacuated. About 30 cars were submerged in the club car park. Many houses throughout Brisbane's southern suburbs were also flooded. Over 100 homes were inundated in Wishart (southern suburb). Heavy rain downed powerlines at Annerley, Woolloongabba, Greenslopes and Holland Park. A block of flats at Greenslopes had the roof torn off. Cars that were stalled on flooded roads caused peak-hour traffic chaos. Many cars that had been left in flooded streets floated away. A car dealership in Salisbury reported damage to about 50 vehicles.<br /> The northern suburbs of McDowall, Windsor, Ferny Hills, Arana Hills and Everton Hills also recorded severe water damage. In the northern suburb of Aspley,six new cars were swept from the yard of a car dealership and into Cabbage Tree Creek and another 80 new vehicles were damaged. Flash flooding caused problems in Everton Hills near Kedron Brook.<br /> Sunshine Coast: A person was rescued from a vehicle that was washed into a waterway. Shops in the main street of Beerwah were flooded, trees came down on powerlines and cars were swept away. Numerous traffic accidents were reported. Flash flooding was also reported near Sunrise Beach, and at Noosaville, Nambour, Eumundi and Hunchy. Powerlines were brought down at Nambour. Two homes were evacuated when it was believed that the roofs could be blown off.",SEQ,Storm,2001,37000000,115585083,,,,,,,,,,
Undeclared,Cyclone Winsome,8/20/2001,11/20/2001,2001-02,NT,,A category 1 cyclone impacting the NT from the Gulf of Carpentaria. Minor damage reported.,,Cyclone,2001,,,,,,,,,,,,
CAT011,Dubbo Severe Storm Event,6/20/2001,6/20/2001,2000-01,NSW,,"Dubbo (Central Western Slopes) in New South Wales experienced a very severe thunderstorm late in the day. Damage was caused by strong winds, large hailstones and flash flooding. Approximately 50 mm of rain and hail was recorded in around thirty minutes and wind gusts of up to 130 km per hour resulted in hundreds of falling trees. It was estimated 400 buildings and 150 motor vehicles were damaged. Dubbo was declared a natural disaster area and it was later reported that approximately 5% of houses sustained damage from the storm.",,Storm,2001,15000000,39284641,,,,,,,,,,
CAT014,North Coast NSW Floods and Storms,5/20/2001,5/20/2001,2000-01,NSW,,"The development of a low-pressure system off the New South Wales North Coast caused torrential rain on 2 March before dissipating as it entered Queensland.  Heavy rainfall intensified over the following days, particularly in the Coffs Harbour and Port Macquarie regions.<br /> River systems in the region were at capacity and tidal systems in correlation with the king tides  also caused water levels to rise. The following river systems were affected; Richmond, Clarence, Bellinger, Nambucca, Macleay, Hastings, Manning, Paterson and Hunter.<br /> The rising water exceeded levees in Kempsey and the traffic bridge at Kempsey peaked at a height of 6.9 metres. A reported 94 businesses suffered damage, with an estimated direct cost of $28,000 per business, while streets were closed to traffic. At the Mirriwina Gardens settlements, 50 kilometres north-west of Kempsey, 100 people were evacuated.<br /> The Clarence River also threatened to exceed levees, causing precautionary evacuations of more than 1000 people, including 80 patients from the Grafton Hospital.  The Grafton levee bank was able to hold the water within the river system, which finally peaked at 7.75 metres.<br /> The effects of the flooding were wide spread and inundations and dislocation of services affected up to 28 local government areas.  The Pacific Highway, the main route in many of these regions, was cut for several days. It was also reported that some rail services were suspended.<br /> Further flood impact was reported at Yamba, which was isolated by flood waters, while sewerage infrastructure failure was reported at Gladstone and Smithtown, and at Ulmarra (population of 470), residents were ordered to evacuate.  Bellingen, Thora, Kaland and Darkwood, South West Rocks, Hat Head, and Crescent Head were also isolated and required food and medical drops by helicopter.<br /> The response units included; State Emergency Services (SES) with a contingent of 1300 volunteers from 83 units, Rural Fire Service (RFS), New South Wales Fire Brigade (NSWFB), Volunteer Rescue Association (VRA), Police, and Council workers.  Additional supporting equipment used in the response included; ten heavy tankers, 12 flood boats, and 11 helicopters.<br /> The enormity of the recovery resulted in the Premier establishing a whole of Government task force to coordinate the operation.   Brigadier Philip McNamara was appointed the regional coordinator for the recovery effort and was based at Coffs Harbour.",,Flooding,2001,39450000,118024192,,,,,,,,,,
Undeclared,Cyclone Vincent,5/20/2001,2/15/2001,2000-01,WA,,A category 2 cyclone that made landfall near Eighty Mile Beach in WA. Minor damage reported.,,Cyclone,2001,,,,,,,,,,,,
Undeclared,Cyclone Paula,2/25/2001,5/20/2001,2000-01,QLD,,A category 4 cyclone that remained offshore in the Coral Sea. No signifciant damage reported on Australian territory.,FNQ,Cyclone,2001,,,,,,,,,,,,
Undeclared,Cyclone Abigail,2/22/2001,2/27/2001,2000-01,QLD,,"A category 3 cyclone that crossed Cape york from the Coral Sea, inot the Gulf of Carpentaria. Minor damage and catchment flooding reported.",FNQ,Cyclone,2001,,,,,,,,,,,,
Undeclared,Cyclone Terri,1/28/2001,1/31/2001,2000-01,WA,,A category 2 cyclone that made landfall near Pardoo on the WA north coast. Minor damage and localised flooding was reported.,,Cyclone,2001,,,,,,,,,,,,
Undeclared,Armidale Hailstorm,1/24/2001,2/20/2001,2000-01,NSW,,"Thunderstorms developed in northern NSW during the mid to late afternoon along an inland trough. Armidale was lashed by golf ball size hail around 5.30pm damaging 60 homes and 40 cars. Orchards and trees stripped and roof tiles, skylights and windows broken. The main highway was closed after hail piled up 15cm deep with hail still on the ground at noon the following day.",,Hailstorm,2001,5000000,12777148,,,,,,,,,,
CAT013,Casino Severe Storm Event,1/17/2001,1/17/2001,2000-01,NSW,,"On 17 January 2001, north-eastern New South Wales experienced a severe thunderstorm, with the worst impact occurring in the town of Casino. Heavy rain caused local flash flooding. Approximately 59 mm of rain was recorded including 31 mm in just ten minutes. Hailstones up to 7 cm were reported in some areas. Gale force winds in some instances exceeding 110 km per hour inflicted damage to 800 homes and 300 motor vehicles. Power lines fell, cutting power to the town. It is estimated that 30,000 properties lost power in the region as a result of the storm. As the storm moved towards Queensland, a 73 knot gust was recorded at the Evans head weather station.",,Storm,2001,35000000,80667832,,,,,,,,,,
CAT012,Sydney Severe Storm Event,1/15/2001,1/15/2001,2000-01,NSW,,"On 15 January 2001, maximum temperatures reached 46 ?C degrees at the Sydney suburb of Penrith before a cool change moved through with accompanying wind gusts up to 113 km per hour. The wind impacted Sydney's metropolitan area, and caused considerable damage to property, trees and fences and thousands of homes lost electricity.",,Storm,2001,12000000,31468091,,,,,,,,,,
Undeclared,Cyclone ROSITA,4/14/2000,4/20/2000,1999-00,WA,,"A category 4 cyclone developed north of Port Hedland, making landfall along the Kimberly coast south of Broome. Rosita left  significant structural damage to the Echo Beach tourist resort, Yardoogarra and Thangoo Stations, as well as considerable damage to trees and powerlines.",,Cyclone,2000,,,,,,,,,,,,
Undeclared,Cyclone VAUGHAN,3/20/2000,7/20/2000,1999-00,QLD,,A category 2 cyclone forming in the Coral Sea headed westward towards North Queensland. No significant damage. ,FNQ,Cyclone,2000,,,,,,,,,,,,
Undeclared,Cyclone OLGA,3/15/2000,3/20/2000,1999-00,WA,,A category 2 cyclone that developed in the Timor Sea and maintained a presence parallell to the Kimberly and Pilbara coasts of Western Austalia. No Australian landfall.,,Cyclone,2000,,,,,,,,,,,,
Undeclared,Cyclone NORMAN,2/28/2000,10/20/2000,1999-00,WA,,A categroy 4 cyclone that reamined off the Pilbara coastline. No Asutralian landfall.,,Cyclone,2000,,,,,,,,,,,,
CAT003,Cyclone Steve,2/27/2000,11/20/2000,1999-00,QLD,,"Cyclone Steve formed in the northern Coral Sea, near Willis Island, and developed into a cyclone at approximately 7 am on 27 February 2000. The cyclone intensified further during the day to reach Category 2 intensity by 1 pm, before crossing the east Queensland coast to the near north of Cairns at approximately 7 pm. Cyclone Steve caused major flooding between Cairns and Mareeba. A record flood level of 12.4 m was reached at Mareeba at 4.37 am on 28 February 2000, with 90 people requiring evacuation and the railway bridge washed away. Many buildings in Cairns suffered severe water damage including the Cairns Hospital. Wind gusts of up to 150 km per hour caused several buildings in Cairns and Kuranda to lose their roofs. Hundreds of trees were uprooted and powerlines were brought down throughout the district, disrupting supplies to more than 40,000 residents. The two highways to the Atherton Tablelands were closed by fallen trees and landslides. Crop damage by floods and winds was severe, notably the sugar cane industry. Cairns Emergency Services answered over 1200 calls during the course of Cyclone Steve, while the Disaster Coordination Centre took another 1800 calls. One person from the town of Cardwell was killed by the floods following the cyclone.",FNQ,Cyclone,2000,11000000,37883862,,,,,,,,,,
Undeclared,Cyclone MARCIA,2/15/2000,2/18/2000,1999-00,WA,,Indian Ocean category 1 cyclone. No Austalian landfall.. ,,Cyclone,2000,,,,,,,,,,,,
Undeclared,Cyclone KIRRILY,1/24/2000,2/20/2000,1999-00,WA,,"A category 2 cyclone that formed east of Cocos Island, however did not make Australian landfall.",,Cyclone,2000,,,,,,,,,,,,
CAT002,"Flood, Storm",1/20/2000,2/28/2000,1999-00,QLD,,"In February 2000, Queensland?s far north experienced heavy rainfall during three distinct wet periods. The first of these affected coastal catchments from Mackay to Ingham from early to mid-February, Then from mid-February, heavy rainfall occurred in the far western catchments, followed by Cyclone Steven in late February, which caused flooding from Ingham to Cooktown.  Across the month of February, minor flooding occurred at Pioneer River, Burdekin River, Barron River, Paroo River and Gulf River. Moderate and/or major flooding occurred at Don River, Haughton River, Herbert River, Tully River, Bulloo River, lower Barron River, Thomson River, Barcoo River, Cooper Creek, Diamantina River and Georgina River/Eyre Creek.The city of Cairns was also affected. Emergency services opened a disaster co-ordination centre after a record 208 mm deluge. More than 3000 sandbags were distributed to Cairns residents and it was reported that around whilst 10,000 residents experienced blackouts. Almost a third of Queensland was declared a natural disaster area by the State Government in the wake of the extensive flooding throughout northern, central and western Queensland.  In relative terms one out of three individuals were directly affected by the floods. Wide spread floods caused damage to plantations, crops and infrastructure, which resulted in several large damage estimates. ",FNQ,Flooding,2000,82000000,322191702,,,,,,,,,,
Undeclared,Cyclone LEON,1/20/2000,8/20/2000,1999-00,WA,,A low pressure area developed within the monsoon trough south of Bali.making tracks west - southward over northwestern Australia. This developed into a category 3 cyclone that did not make landfall.  ,,Cyclone,2000,,,,,,,,,,,,
CAT998,Melbourne Flooding,12/26/1999,12/28/1999,1999-00,VIC,,"On 26 to 28 December 1999, high rainfall in the northern suburbs of Melbourne caused localised flooding. In Carisbrook, central Victoria, over the same period the local catchment area received the most significant rainfall totals in more than 100 years. The southwest side of the town was flooded by overland flows from the Mosquito Flat and Craigie catchment area between Carisbrook and Maryborough. A number of properties in the town were affected and the Pyrenees Highway was closed.",,Flooding,1999,10000000,35795703,,,,,,,,,,
CAT997,Illawarra Storm,10/24/1999,10/24/1999,1999-00,NSW,,"On 24 October 1999, severe thunderstorms affected the mid-north coast and northern rivers districts of New South Wales. Twenty three yachts on Sydney Harbour were damaged and lightning cut power across parts of Sydney. Strong winds brought down trees in many Sydney suburbs. At Kendall in the mid-north coast, 5.5 cm diameter hail was reported. It dented cars, broke windows and skylights, and destroyed gardens. The Illawarra Escarpment received the heaviest rainfall in this event with Wattamolla (Tamol) recording 340 mm over two days. Includes CAT996",,Storm,1999,45000000,129987154,,,,,,,,,,
Undeclared,Cyclone JOHN,9/19/1999,12/16/1999,1999-00,WA,,"Tropical Cyclone John was an intense early season cyclone that crossed the Pilbara coast between Port Hedland and Karratha near Whim Creek on 15 December. Extensive damage was done to the Whim Creek hotel. Some damage also occurred in neighbouring areas, however the communities of Dampier, Karratha, Roebourne and Wickham were fortunate to escape the most destructive winds near the centre of the cyclone.",,Cyclone,1999,,,,,,,,,,,,
CAT991,"Flood, Storm",8/19/1999,,1999-00,QLD,,SE QLD,SEQ,Storm,1999,2000000,8050488,,,,,,,,,,
Undeclared,Cyclone ILSA,8/19/1999,12/17/1999,1999-00,WA,,"Tropical Cyclone Ilsa, formed to the northeast of Cocos Islands on 11 December 1999. It was tracked for a period of almost nine days and its development was impeded by vertical windshear for a large part of its lifetime. After a long track eastwards across the Indian Ocean it eventually crossed the WA coastline along the Eighty Mile Beach during the early afternoon of 17 December. During the lifetime of Ilsa , Tropical Cyclone John formed in the Timor Sea and crossed the Pilbara coast on the morning of 15 December.",,Cyclone,1999,,,,,,,,,,,,
CAT995,Eastern Sydney Hailstorm,4/14/1999,4/14/1999,1998-99,NSW,,"At approximately 7.45 pm on 14 April 1999, a torrential hailstorm hit Sydney's inner and eastern suburbs, damaging thousands of homes and cars. Hailstones the size of cricket balls hit the city at more than 200 km per hour. The storm hit 85 suburbs, causing damage to 20,000 houses including windows, roofs and skylights. Seventy thousand cars sustained windscreen and panel damage. The worst affected areas included the south-east suburbs of Kensington, Kingsford, Botany, Mascot, Randwick and Paddington. The NSW Government Fire & Rescue reported that 2000 emergency calls were made in the first five hours of the event and 1092 incidents were recorded. One person died as a result of the storm.",,Hailstorm,1999,1700000000,5574498958,,20000,,70000,,,,,,
